{
  "schemaVersion": 2,
  "id": "valid-shepherd",
  "source": "summon sheep\n    riding rocket\nsend skyward\nrest 8 seconds",
  "result": {
    "status": "accepted",
    "compilerVersion": "scribe-compiler/0.2",
    "canonicalHex": "7363726962652d636f6d70696c65722f302e320a73756d6d6f6e7c73686565707c6361737465727c726f636b65740a73656e645f736b79776172640a726573747c34303230303030303030303030303030",
    "identitySha256": "a9b2c90b95ee7bc020fbe2c5ecfe1bdcab8fa8da653a783a8af040f85fbb32dd",
    "actions": [
      {
        "opcode": "summon",
        "noun": "sheep",
        "place": "caster",
        "aheadBits": null,
        "patient": null,
        "riding": "rocket",
        "valueBits": null
      },
      {
        "opcode": "send_skyward",
        "noun": null,
        "place": null,
        "aheadBits": null,
        "patient": null,
        "riding": null,
        "valueBits": null
      },
      {
        "opcode": "rest",
        "noun": null,
        "place": null,
        "aheadBits": null,
        "patient": null,
        "riding": null,
        "valueBits": "4020000000000000"
      }
    ]
  }
}
